{
  "version": null,
  "capture": {
    "state": "waiting",
    "failure": null,
    "error": null,
    "failedAttempts": 0,
    "frames": 0
  },
  "esp32": {
    "enabled": true,
    "hosts": [],
    "framesSent": 0,
    "sendErrors": 0,
    "lastError": null
  },
  "hyperhdr": {
    "enabled": false
  },
  "outputs": {
    "source": "package",
    "esp32": {
      "enabled": true
    },
    "hyperhdr": {
      "enabled": false,
      "host": "",
      "port": 19400,
      "priority": 150
    }
  },
  "configWarnings": []
}
